{
  "schema_version": "1.1",
  "product": "APK Sentinel",
  "status": "expired",
  "endpoint_publicly_callable": true,
  "endpoint": "https://api.willowbirdie.com/v1/apk/triage",
  "browser_upload": false,
  "general_customer_intake": false,
  "customer_support": false,
  "payment": {
    "enabled": false,
    "mechanism": "x402 v2 exact",
    "network": "Base mainnet",
    "network_id": "eip155:8453",
    "price_usdc": "0.01",
    "atomic_amount": "10000",
    "test_ends": "2026-09-05T23:59:59Z",
    "terms_status": "expired"
  },
  "last_verified": "2026-10-20",
  "reviewed_at": "2026-10-20T20:23:43Z",
  "availability_note": "Worker readiness was reverified on 2026-10-20: the analysis pipeline completed a synthetic fixture end to end and cleaned up afterwards. Paid analysis is still not offered, because the published beta terms expired on 2026-09-05 and have not been replaced. An unpaid challenge remains observable. Do not submit payment or private APKs.",
  "observed_unpaid_challenge": {
    "checked_at": "2026-10-20T20:23:43Z",
    "http_status": 402,
    "network_id": "eip155:8453",
    "atomic_amount": "10000",
    "asset": "0x833589fCD6eDb6E08f4c7C32D4f71b54bdA02913",
    "scope": "Unpaid empty POST only. Worker readiness was separately verified with a synthetic fixture, not through this endpoint; no upload, payment, settlement or customer intake was exercised."
  }
}
